{
    "identifier": 535,
    "versioning": "https://miilucl.github.io/dcouvr/sesam/sesam_v0/profile_schema.html",
    "timestamp": "2024-01-21T18:47:34.738502",
    "preferences": {
        "categories": [
            {
                "name": "SOIRÉES - retro (rock, swing)",
                "termCode": "CAT10-18",
                "inDefinedTermSet": "https://miilucl.github.io/dcouvr/sesam/sesam_v0/termSets/DefinedTermSet_categories.csv",
                "rating": 3,
                "timestamp": "2024-01-21T18:47:34.733514"
            },
            {
                "name": "FÊTES / FOLKLORE",
                "termCode": "CAT14-00",
                "inDefinedTermSet": "https://miilucl.github.io/dcouvr/sesam/sesam_v0/termSets/DefinedTermSet_categories.csv",
                "rating": 5,
                "timestamp": "2024-01-21T18:47:34.734513"
            },
            {
                "name": "THÉATRE / SPECTACLES - comédie musicale",
                "termCode": "CAT02-05",
                "inDefinedTermSet": "https://miilucl.github.io/dcouvr/sesam/sesam_v0/termSets/DefinedTermSet_categories.csv",
                "rating": 2,
                "timestamp": "2024-01-21T18:47:34.735509"
            }
        ],
        "audiences": [],
        "areas": [
            {
                "name": "La Louvière",
                "termCode": "LOC16",
                "inDefinedTermSet": "https://miilucl.github.io/dcouvr/sesam/sesam_v0/termSets/DefinedTermSet_location.csv",
                "rating": 4,
                "timestamp": "2024-01-21T18:47:34.736507"
            },
            {
                "name": "province du Brabant wallon",
                "termCode": "LOC05",
                "inDefinedTermSet": "https://miilucl.github.io/dcouvr/sesam/sesam_v0/termSets/DefinedTermSet_location.csv",
                "rating": 5,
                "timestamp": "2024-01-21T18:47:34.737507"
            }
        ],
        "culturalProducts": [],
        "culturalOperators": [
            {
                "identifier": 20005,
                "name": "Librairie Toutes Directions",
                "rating": 4,
                "timestamp": "2024-01-21T18:47:34.737507"
            },
            {
                "identifier": 20004,
                "name": "Plaza",
                "rating": 5,
                "timestamp": "2024-01-21T18:47:34.737507"
            },
            {
                "identifier": 20008,
                "name": "Centre Culturel d'Amay",
                "rating": 1,
                "timestamp": "2024-01-21T18:47:34.737507"
            },
            {
                "identifier": 20006,
                "name": "Palais des Beaux-Arts de Bruxelles - Bozar",
                "rating": 5,
                "timestamp": "2024-01-21T18:47:34.737507"
            },
            {
                "identifier": 20008,
                "name": "Centre Culturel d'Amay",
                "rating": 4,
                "timestamp": "2024-01-21T18:47:34.737507"
            }
        ],
        "culturalCreators": [
            {
                "identifier": 30002,
                "name": "Jacques Brel",
                "rating": 2,
                "timestamp": "2024-01-21T18:47:34.737507"
            },
            {
                "identifier": 30013,
                "name": "Cirque Nicolas Bouglione",
                "rating": 1,
                "timestamp": "2024-01-21T18:47:34.737507"
            },
            {
                "identifier": 30010,
                "name": "Belgian Red Flames",
                "rating": 3,
                "timestamp": "2024-01-21T18:47:34.738502"
            },
            {
                "identifier": 30007,
                "name": "Emilie Dequenne",
                "rating": 3,
                "timestamp": "2024-01-21T18:47:34.738502"
            },
            {
                "identifier": 30006,
                "name": "Lukas Dhont",
                "rating": 2,
                "timestamp": "2024-01-21T18:47:34.738502"
            }
        ]
    }
}