{
    "identifier": 855,
    "versioning": "https://miilucl.github.io/dcouvr/sesam/sesam_v0/profile_schema.html",
    "timestamp": "2024-01-21T18:47:34.721030",
    "preferences": {
        "categories": [
            {
                "name": "FÊTES / FOLKLORE",
                "termCode": "CAT14-00",
                "inDefinedTermSet": "https://miilucl.github.io/dcouvr/sesam/sesam_v0/termSets/DefinedTermSet_categories.csv",
                "rating": 1,
                "timestamp": "2024-01-21T18:47:34.717041"
            },
            {
                "name": "CONCERTS - reggae / ragga / dub / ska",
                "termCode": "CAT01-16",
                "inDefinedTermSet": "https://miilucl.github.io/dcouvr/sesam/sesam_v0/termSets/DefinedTermSet_categories.csv",
                "rating": 1,
                "timestamp": "2024-01-21T18:47:34.718038"
            },
            {
                "name": "MARCHÉS ET BROCANTES - marché de noël",
                "termCode": "CAT13-05",
                "inDefinedTermSet": "https://miilucl.github.io/dcouvr/sesam/sesam_v0/termSets/DefinedTermSet_categories.csv",
                "rating": 4,
                "timestamp": "2024-01-21T18:47:34.719035"
            },
            {
                "name": "FÊTES / FOLKLORE - festivités",
                "termCode": "CAT14-03",
                "inDefinedTermSet": "https://miilucl.github.io/dcouvr/sesam/sesam_v0/termSets/DefinedTermSet_categories.csv",
                "rating": 5,
                "timestamp": "2024-01-21T18:47:34.720033"
            }
        ],
        "audiences": [],
        "areas": [],
        "culturalProducts": [
            {
                "identifier": 10002,
                "name": "Cro'Medy Club #1",
                "type": "Event",
                "rating": 2,
                "timestamp": "2024-01-21T18:47:34.720033"
            }
        ],
        "culturalOperators": [
            {
                "identifier": 20004,
                "name": "Plaza",
                "rating": 1,
                "timestamp": "2024-01-21T18:47:34.720033"
            },
            {
                "identifier": 20005,
                "name": "Librairie Toutes Directions",
                "rating": 3,
                "timestamp": "2024-01-21T18:47:34.720033"
            },
            {
                "identifier": 20009,
                "name": "The Music Village",
                "rating": 4,
                "timestamp": "2024-01-21T18:47:34.720033"
            },
            {
                "identifier": 20001,
                "name": "Blues-sphere Bar",
                "rating": 4,
                "timestamp": "2024-01-21T18:47:34.721030"
            }
        ],
        "culturalCreators": [
            {
                "identifier": 30001,
                "name": "Girls in Hawaii",
                "rating": 2,
                "timestamp": "2024-01-21T18:47:34.721030"
            },
            {
                "identifier": 30002,
                "name": "Jacques Brel",
                "rating": 5,
                "timestamp": "2024-01-21T18:47:34.721030"
            },
            {
                "identifier": 30016,
                "name": "Jean Merveille",
                "rating": 3,
                "timestamp": "2024-01-21T18:47:34.721030"
            },
            {
                "identifier": 30004,
                "name": "Damso",
                "rating": 1,
                "timestamp": "2024-01-21T18:47:34.721030"
            }
        ]
    }
}