{
    "identifier": 842,
    "versioning": "https://miilucl.github.io/dcouvr/sesam_v0/profile_schema.html",
    "timestamp": "2024-01-17T17:56:40.479958",
    "preferences": {
        "categories": [],
        "audiences": [],
        "areas": [
            {
                "name": "Thuin",
                "termCode": "LOC14",
                "inDefinedTermSet": "https://miilucl.github.io/dcouvr/sesam_v0/termSets/DefinedTermSet_location.csv",
                "rating": 1,
                "timestamp": "2024-01-17T17:56:40.477960"
            }
        ],
        "culturalProducts": [],
        "culturalOperators": [
            {
                "identifier": 20002,
                "name": "Maison de la Jeunesse de Woluwe-Saint-Lambert",
                "rating": 4,
                "timestamp": "2024-01-17T17:56:40.478965"
            },
            {
                "identifier": 20003,
                "name": "Extension ULB de Jodoigne & Environs",
                "rating": 1,
                "timestamp": "2024-01-17T17:56:40.478965"
            },
            {
                "identifier": 20001,
                "name": "Blues-sphere Bar",
                "rating": 2,
                "timestamp": "2024-01-17T17:56:40.478965"
            },
            {
                "identifier": 20007,
                "name": "Centre Culturel de Chênée",
                "rating": 4,
                "timestamp": "2024-01-17T17:56:40.478965"
            }
        ],
        "culturalCreators": [
            {
                "identifier": 30005,
                "name": "iliona",
                "rating": 5,
                "timestamp": "2024-01-17T17:56:40.478965"
            },
            {
                "identifier": 30014,
                "name": "Jean Van Hamme",
                "rating": 4,
                "timestamp": "2024-01-17T17:56:40.478965"
            },
            {
                "identifier": 30008,
                "name": "Guillermo Guiz",
                "rating": 1,
                "timestamp": "2024-01-17T17:56:40.478965"
            },
            {
                "identifier": 30013,
                "name": "Cirque Nicolas Bouglione",
                "rating": 3,
                "timestamp": "2024-01-17T17:56:40.478965"
            },
            {
                "identifier": 30010,
                "name": "Belgian Red Flames",
                "rating": 3,
                "timestamp": "2024-01-17T17:56:40.479958"
            }
        ]
    }
}