{
    "identifier": 656,
    "versioning": "https://miilucl.github.io/dcouvr/sesam/sesam_v0/profile_schema.html",
    "timestamp": "2024-01-21T18:47:34.753429",
    "preferences": {
        "categories": [],
        "audiences": [
            {
                "name": "Etudiants",
                "termCode": "AUD06",
                "inDefinedTermSet": "https://miilucl.github.io/dcouvr/sesam/sesam_v0/termSets/DefinedTermSet_audience.csv",
                "rating": 3,
                "timestamp": "2024-01-21T18:47:34.750448"
            },
            {
                "name": "Conjoint",
                "termCode": "AUD02",
                "inDefinedTermSet": "https://miilucl.github.io/dcouvr/sesam/sesam_v0/termSets/DefinedTermSet_audience.csv",
                "rating": 1,
                "timestamp": "2024-01-21T18:47:34.751435"
            }
        ],
        "areas": [],
        "culturalProducts": [
            {
                "identifier": 10009,
                "name": "New project : KAIS FRIHAT QUARTET",
                "type": "Event",
                "rating": 4,
                "timestamp": "2024-01-21T18:47:34.752432"
            },
            {
                "identifier": 10003,
                "name": "L'église Saint-Médard de Jodoigne",
                "type": "Event",
                "rating": 4,
                "timestamp": "2024-01-21T18:47:34.752432"
            },
            {
                "identifier": 10007,
                "name": "Didier Laloy Dyad & Strings Quartet ",
                "type": "Event",
                "rating": 2,
                "timestamp": "2024-01-21T18:47:34.752432"
            }
        ],
        "culturalOperators": [
            {
                "identifier": 20005,
                "name": "Librairie Toutes Directions",
                "rating": 4,
                "timestamp": "2024-01-21T18:47:34.752432"
            },
            {
                "identifier": 20005,
                "name": "Librairie Toutes Directions",
                "rating": 2,
                "timestamp": "2024-01-21T18:47:34.752432"
            },
            {
                "identifier": 20009,
                "name": "The Music Village",
                "rating": 3,
                "timestamp": "2024-01-21T18:47:34.752432"
            }
        ],
        "culturalCreators": [
            {
                "identifier": 30017,
                "name": "David Van Reybroeck",
                "rating": 3,
                "timestamp": "2024-01-21T18:47:34.753429"
            },
            {
                "identifier": 30007,
                "name": "Emilie Dequenne",
                "rating": 5,
                "timestamp": "2024-01-21T18:47:34.753429"
            },
            {
                "identifier": 30004,
                "name": "Damso",
                "rating": 1,
                "timestamp": "2024-01-21T18:47:34.753429"
            },
            {
                "identifier": 30007,
                "name": "Emilie Dequenne",
                "rating": 4,
                "timestamp": "2024-01-21T18:47:34.753429"
            },
            {
                "identifier": 30005,
                "name": "iliona",
                "rating": 4,
                "timestamp": "2024-01-21T18:47:34.753429"
            }
        ]
    }
}