{
    "identifier": 641,
    "versioning": "https://miilucl.github.io/dcouvr/sesam/sesam_v0/profile_schema.html",
    "timestamp": "2024-01-21T18:47:34.690491",
    "preferences": {
        "categories": [
            {
                "name": "THÉATRE / SPECTACLES - professionnel",
                "termCode": "CAT02-02",
                "inDefinedTermSet": "https://miilucl.github.io/dcouvr/sesam/sesam_v0/termSets/DefinedTermSet_categories.csv",
                "rating": 2,
                "timestamp": "2024-01-21T18:47:34.672280"
            }
        ],
        "audiences": [],
        "areas": [
            {
                "name": "Philippeville",
                "termCode": "LOC22",
                "inDefinedTermSet": "https://miilucl.github.io/dcouvr/sesam/sesam_v0/termSets/DefinedTermSet_location.csv",
                "rating": 3,
                "timestamp": "2024-01-21T18:47:34.677068"
            },
            {
                "name": "Tournai",
                "termCode": "LOC15",
                "inDefinedTermSet": "https://miilucl.github.io/dcouvr/sesam/sesam_v0/termSets/DefinedTermSet_location.csv",
                "rating": 1,
                "timestamp": "2024-01-21T18:47:34.678065"
            },
            {
                "name": "Province de Liège",
                "termCode": "LOC02",
                "inDefinedTermSet": "https://miilucl.github.io/dcouvr/sesam/sesam_v0/termSets/DefinedTermSet_location.csv",
                "rating": 4,
                "timestamp": "2024-01-21T18:47:34.679062"
            }
        ],
        "culturalProducts": [
            {
                "identifier": 10004,
                "name": "Explo - Bretagne",
                "type": "Event",
                "rating": 3,
                "timestamp": "2024-01-21T18:47:34.684081"
            },
            {
                "identifier": 10008,
                "name": "\"Les Bonnes\" de Jean genet",
                "type": "Event",
                "rating": 5,
                "timestamp": "2024-01-21T18:47:34.684081"
            },
            {
                "identifier": 10005,
                "name": "Vos livres ont la parole !",
                "type": "Event",
                "rating": 1,
                "timestamp": "2024-01-21T18:47:34.685046"
            },
            {
                "identifier": 10004,
                "name": "Explo - Bretagne",
                "type": "Event",
                "rating": 3,
                "timestamp": "2024-01-21T18:47:34.685046"
            },
            {
                "identifier": 10003,
                "name": "L'église Saint-Médard de Jodoigne",
                "type": "Event",
                "rating": 3,
                "timestamp": "2024-01-21T18:47:34.685046"
            }
        ],
        "culturalOperators": [
            {
                "identifier": 20005,
                "name": "Librairie Toutes Directions",
                "rating": 3,
                "timestamp": "2024-01-21T18:47:34.690491"
            },
            {
                "identifier": 20005,
                "name": "Librairie Toutes Directions",
                "rating": 2,
                "timestamp": "2024-01-21T18:47:34.690491"
            },
            {
                "identifier": 20004,
                "name": "Plaza",
                "rating": 2,
                "timestamp": "2024-01-21T18:47:34.690491"
            },
            {
                "identifier": 20007,
                "name": "Centre Culturel de Chênée",
                "rating": 5,
                "timestamp": "2024-01-21T18:47:34.690491"
            },
            {
                "identifier": 20004,
                "name": "Plaza",
                "rating": 5,
                "timestamp": "2024-01-21T18:47:34.690491"
            }
        ],
        "culturalCreators": []
    }
}