{
    "identifier": 784,
    "versioning": "https://miilucl.github.io/dcouvr/sesam_v0/profile_schema.html",
    "timestamp": "2024-01-17T17:56:40.521221",
    "preferences": {
        "categories": [
            {
                "name": "CONCERTS - revue / danse cabaret",
                "termCode": "CAT01-17",
                "inDefinedTermSet": "https://miilucl.github.io/dcouvr/sesam_v0/termSets/DefinedTermSet_categories.csv",
                "rating": 1,
                "timestamp": "2024-01-17T17:56:40.519227"
            }
        ],
        "audiences": [],
        "areas": [
            {
                "name": "Dinant",
                "termCode": "LOC18",
                "inDefinedTermSet": "https://miilucl.github.io/dcouvr/sesam_v0/termSets/DefinedTermSet_location.csv",
                "rating": 4,
                "timestamp": "2024-01-17T17:56:40.520223"
            },
            {
                "name": "Mouscron",
                "termCode": "LOC21",
                "inDefinedTermSet": "https://miilucl.github.io/dcouvr/sesam_v0/termSets/DefinedTermSet_location.csv",
                "rating": 4,
                "timestamp": "2024-01-17T17:56:40.520223"
            }
        ],
        "culturalProducts": [
            {
                "identifier": 10003,
                "name": "L'église Saint-Médard de Jodoigne",
                "type": "Event",
                "rating": 5,
                "timestamp": "2024-01-17T17:56:40.521221"
            },
            {
                "identifier": 10002,
                "name": "Cro'Medy Club #1",
                "type": "Event",
                "rating": 3,
                "timestamp": "2024-01-17T17:56:40.521221"
            },
            {
                "identifier": 10006,
                "name": "Meet the artist: Baloji",
                "type": "Event",
                "rating": 5,
                "timestamp": "2024-01-17T17:56:40.521221"
            }
        ],
        "culturalOperators": [],
        "culturalCreators": [
            {
                "identifier": 30004,
                "name": "Damso",
                "rating": 5,
                "timestamp": "2024-01-17T17:56:40.521221"
            }
        ]
    }
}