{
    "identifier": 844,
    "versioning": "https://miilucl.github.io/dcouvr/sesam/sesam_v0/profile_schema.html",
    "timestamp": "2024-01-21T18:47:34.765836",
    "preferences": {
        "categories": [
            {
                "name": "STAGES / COURS - art plastique",
                "termCode": "CAT09-02",
                "inDefinedTermSet": "https://miilucl.github.io/dcouvr/sesam/sesam_v0/termSets/DefinedTermSet_categories.csv",
                "rating": 3,
                "timestamp": "2024-01-21T18:47:34.761847"
            }
        ],
        "audiences": [
            {
                "name": "Enfants (7 à 11 ans)",
                "termCode": "AUD04",
                "inDefinedTermSet": "https://miilucl.github.io/dcouvr/sesam/sesam_v0/termSets/DefinedTermSet_audience.csv",
                "rating": 4,
                "timestamp": "2024-01-21T18:47:34.762844"
            }
        ],
        "areas": [
            {
                "name": "La Louvière",
                "termCode": "LOC16",
                "inDefinedTermSet": "https://miilucl.github.io/dcouvr/sesam/sesam_v0/termSets/DefinedTermSet_location.csv",
                "rating": 5,
                "timestamp": "2024-01-21T18:47:34.763842"
            },
            {
                "name": "province de Namur",
                "termCode": "LOC04",
                "inDefinedTermSet": "https://miilucl.github.io/dcouvr/sesam/sesam_v0/termSets/DefinedTermSet_location.csv",
                "rating": 3,
                "timestamp": "2024-01-21T18:47:34.764839"
            }
        ],
        "culturalProducts": [
            {
                "identifier": 10002,
                "name": "Cro'Medy Club #1",
                "type": "Event",
                "rating": 1,
                "timestamp": "2024-01-21T18:47:34.764839"
            },
            {
                "identifier": 10002,
                "name": "Cro'Medy Club #1",
                "type": "Event",
                "rating": 4,
                "timestamp": "2024-01-21T18:47:34.764839"
            },
            {
                "identifier": 10009,
                "name": "New project : KAIS FRIHAT QUARTET",
                "type": "Event",
                "rating": 3,
                "timestamp": "2024-01-21T18:47:34.764839"
            },
            {
                "identifier": 10008,
                "name": "\"Les Bonnes\" de Jean genet",
                "type": "Event",
                "rating": 5,
                "timestamp": "2024-01-21T18:47:34.764839"
            },
            {
                "identifier": 10008,
                "name": "\"Les Bonnes\" de Jean genet",
                "type": "Event",
                "rating": 1,
                "timestamp": "2024-01-21T18:47:34.764839"
            }
        ],
        "culturalOperators": [
            {
                "identifier": 20004,
                "name": "Plaza",
                "rating": 4,
                "timestamp": "2024-01-21T18:47:34.765836"
            },
            {
                "identifier": 20006,
                "name": "Palais des Beaux-Arts de Bruxelles - Bozar",
                "rating": 2,
                "timestamp": "2024-01-21T18:47:34.765836"
            }
        ],
        "culturalCreators": [
            {
                "identifier": 30001,
                "name": "Girls in Hawaii",
                "rating": 4,
                "timestamp": "2024-01-21T18:47:34.765836"
            },
            {
                "identifier": 30007,
                "name": "Emilie Dequenne",
                "rating": 5,
                "timestamp": "2024-01-21T18:47:34.765836"
            }
        ]
    }
}