{
    "identifier": 517,
    "versioning": "https://miilucl.github.io/dcouvr/sesam_v0/profile_schema.html",
    "timestamp": "2024-01-17T17:56:40.510501",
    "preferences": {
        "categories": [],
        "audiences": [
            {
                "name": "Séniors",
                "termCode": "AUD07",
                "inDefinedTermSet": "https://miilucl.github.io/dcouvr/sesam_v0/termSets/DefinedTermSet_audience.csv",
                "rating": 3,
                "timestamp": "2024-01-17T17:56:40.506023"
            },
            {
                "name": "Séniors",
                "termCode": "AUD07",
                "inDefinedTermSet": "https://miilucl.github.io/dcouvr/sesam_v0/termSets/DefinedTermSet_audience.csv",
                "rating": 1,
                "timestamp": "2024-01-17T17:56:40.507089"
            }
        ],
        "areas": [
            {
                "name": "Verviers",
                "termCode": "LOC11",
                "inDefinedTermSet": "https://miilucl.github.io/dcouvr/sesam_v0/termSets/DefinedTermSet_location.csv",
                "rating": 5,
                "timestamp": "2024-01-17T17:56:40.508236"
            },
            {
                "name": "Arlon",
                "termCode": "LOC24",
                "inDefinedTermSet": "https://miilucl.github.io/dcouvr/sesam_v0/termSets/DefinedTermSet_location.csv",
                "rating": 5,
                "timestamp": "2024-01-17T17:56:40.508236"
            }
        ],
        "culturalProducts": [
            {
                "identifier": 10005,
                "name": "Vos livres ont la parole !",
                "type": "Event",
                "rating": 1,
                "timestamp": "2024-01-17T17:56:40.508236"
            },
            {
                "identifier": 10009,
                "name": "New project : KAIS FRIHAT QUARTET",
                "type": "Event",
                "rating": 2,
                "timestamp": "2024-01-17T17:56:40.509505"
            },
            {
                "identifier": 10008,
                "name": "\"Les Bonnes\" de Jean genet",
                "type": "Event",
                "rating": 3,
                "timestamp": "2024-01-17T17:56:40.509505"
            },
            {
                "identifier": 10004,
                "name": "Explo - Bretagne",
                "type": "Event",
                "rating": 2,
                "timestamp": "2024-01-17T17:56:40.509505"
            },
            {
                "identifier": 10008,
                "name": "\"Les Bonnes\" de Jean genet",
                "type": "Event",
                "rating": 4,
                "timestamp": "2024-01-17T17:56:40.509505"
            }
        ],
        "culturalOperators": [
            {
                "identifier": 20004,
                "name": "Plaza",
                "rating": 4,
                "timestamp": "2024-01-17T17:56:40.509505"
            }
        ],
        "culturalCreators": [
            {
                "identifier": 30015,
                "name": "Zakia Khattabi",
                "rating": 4,
                "timestamp": "2024-01-17T17:56:40.509505"
            },
            {
                "identifier": 30016,
                "name": "Jean Merveille",
                "rating": 3,
                "timestamp": "2024-01-17T17:56:40.509505"
            },
            {
                "identifier": 30016,
                "name": "Jean Merveille",
                "rating": 2,
                "timestamp": "2024-01-17T17:56:40.510501"
            }
        ]
    }
}